統計一下各個商品的平均單價

mysql> SELECT ProductID, AVG(UnitPrice) avg FROM OrderDetails GROUP BY ProductID ORDER BY avg;

mysql> SELECT ProductID, AVG(UnitPrice) avg FROM OrderDetails GROUP BY ProductID ORDER BY avg DESC;

mysql> SELECT ProductID, AVG(UnitPrice) avg FROM OrderDetails GROUP BY ProductID HAVING avg > 70 ORDER BY avg DESC;

mysql> SELECT ProductID, AVG(UnitPrice) avg FROM OrderDetails WHERE ProductID > 10 GROUP BY ProductID HAVING avg > 70 ORDER BY avg DESC;

mysql> SELECT ProductID,SUM(Quantity) sump, SUM(UnitPrice * Quantity) sump, SUM(UnitPrice * Quantity) / SUM(Quantity) avg 
    -> FROM OrderDetails
    -> GROUP BY ProductID;

統計各個客戶的訂單數量
mysql> SELECT CustomerID, COUNT(*) nums FROM Orders GROUP BY CustomerID;

mysql> SELECT CustomerID, COUNT(*) nums FROM Orders GROUP BY CustomerID ORDER BY nums DESC;

mysql> SELECT CustomerID, COUNT(*) nums FROM Orders GROUP BY CustomerID HAVING nums < 10 ORDER BY nums DESC;

mysql> SELECT Freight, ROUND(Freight, 1) FROM Orders;

SELECT ProductName, CONCAT("$", UnitPrice), CONCAT("$", CAST(UnitPrice AS CHAR(10))), UnitsInStock  FROM Products LIMIT 10;

mysql> SELECT ProductID, ProductName FROM Products ORDER BY ProductID LIMIT 0, 10;

mysql> SELECT LastName, BirthDate, HireDate FROM Employees;

mysql> SELECT LastName, BirthDate, HireDate, YEAR(BirthDate) byear, YEAR(HireDate) hyear, YEAR(HireDate)-YEAR(BirthDate) age FROM Employee

mysql> SELECT DATEDIFF('2021-11-13','2021-10-13');
+-------------------------------------+
| DATEDIFF('2021-11-13','2021-10-13') |
+-------------------------------------+
|                                  31 |
+-------------------------------------+
1 row in set (0.00 sec)

mysql> SELECT LastName, BirthDate, HireDate, YEAR(HireDate)-YEAR(BirthDate) age, 
    -> DATEDIFF(HireDate, BirthDate) / 365
    -> FROM Employees;

mysql> SELECT LastName, BirthDate FROM Employees WHERE MONTH(BirthDate ) = MONTH(NOW());


mysql> SELECT OrderID, CustomerID FROM Orders WHERE OrderID = 10248;
+---------+------------+
| OrderID | CustomerID |
+---------+------------+
|   10248 | VINET      |
+---------+------------+
1 row in set (0.00 sec)

mysql> SELECT CustomerID, CompanyName FROM Customers WHERE CustomerID = 'VINET';
+------------+---------------------------+
| CustomerID | CompanyName               |
+------------+---------------------------+
| VINET      | Vins et alcools Chevalier |
+------------+---------------------------+

mysql> SELECT CustomerID, CompanyName FROM Customers WHERE CustomerID = (SELECT CustomerID FROM Orders WHERE OrderID = 10248);
+------------+---------------------------+
| CustomerID | CompanyName               |
+------------+---------------------------+
| VINET      | Vins et alcools Chevalier |
+------------+---------------------------+
1 row in set (0.01 sec)

1997 年有下訂單的客戶編號 => 客戶名稱
mysql> SELECT CustomerID, OrderDate FROM Orders WHERE OrderDate BETWEEN '1997-01-01' AND '1997-12-31';

mysql> SELECT CompanyName FROM Customers WHERE CustomerID IN (SELECT CustomerID FROM Orders WHERE OrderDate BETWEEN '1997-01-01' AND '1997-12-31');

mysql> SELECT ProductName, SupplierID FROM Products WHERE SupplierID IN
    -> (SELECT SupplierID FROM Suppliers WHERE CompanyName IN ('Tokyo Traders', "Mayumi's", 'Pavlova, Ltd.' ));
+------------------+------------+
| ProductName      | SupplierID |
+------------------+------------+
| Konbu            |          6 |
| Tofu             |          6 |
| Genen Shouyu     |          6 |
| Pavlova          |          7 |
| Alice Mutton     |          7 |
| Carnarvon Tigers |          7 |
| Vegie-spread     |          7 |
| Outback Lager    |          7 |
| Mishi Kobe Niku  |          4 |
| Ikura            |          4 |
| Longlife Tofu    |          4 |
+------------------+------------+
11 rows in set (0.01 sec)

mysql> SELECT ProductID, ProductName FROM Products WHERE CategoryID IN (SELECT CategoryID FROM Categories WHERE CategoryName = 'Seafood');
+-----------+---------------------------------+
| ProductID | ProductName                     |
+-----------+---------------------------------+
|        10 | Ikura                           |
|        13 | Konbu                           |
|        18 | Carnarvon Tigers                |
|        30 | Nord-Ost Matjeshering           |
|        36 | Inlagd Sill                     |
|        37 | Gravad lax                      |
|        40 | Boston Crab Meat                |
|        41 | Jack's New England Clam Chowder |
|        45 | Rogede sild                     |
|        46 | Spegesild                       |
|        58 | Escargots de Bourgogne          |
|        73 | Rd Kaviar                       |
+-----------+---------------------------------+
12 rows in set (0.00 sec)

Join 查詢, 合併表查詢
SELECT table1.col1, table1.col2,..., table2.col1, ....
FROM table1 JOIN table2 ON (table1.col = table2.col)
WHERE 條件式
...
...


mysql> SELECT Employees.EmployeeID, Employees.FirstName, Employees.LastName, Orders.OrderID, Orders.OrderDate  
    -> FROM Employees JOIN Orders ON
    -> (Employees.EmployeeID = Orders.EmployeeID);

mysql> SELECT Employees.EmployeeID, Employees.FirstName, Employees.LastName, Orders.OrderID, Orders.OrderDate  
    -> FROM Orders JOIN Employees ON
    -> (Orders.EmployeeID = Employees.EmployeeID );

mysql> SELECT e.EmployeeID, e.FirstName, e.LastName, o.OrderID, o.OrderDate 
    -> FROM Employees e JOIN Orders o ON 
    -> (e.EmployeeID = o.EmployeeID )
    -> ORDER BY o.OrderDate;

多重JOIN
SELECT tb1.col1, tb2.col2, tb3.col3
FROM tb1
        JOIN tb2 ON (tb1.colx = tb2.colx)
        JOIN tb3 ON (tb2.coly = tb3.coly)
......

mysql> SELECT o.OrderID, c.CompanyName, e.LastName 
    -> FROM Orders o
    -> JOIN Employees e ON (o.EmployeeID = e.EmployeeID)
    -> JOIN Customers c ON (o.CustomerID = c.CustomerID)
    -> WHERE o.ShippedDate > o.RequiredDate 
    -> ORDER BY c.CompanyName;

哪些公司的訂單數量在10筆以上(在1997年以後), 顯示公司名稱

SELECT c.CompanyName, COUNT(o.OrderID) nums
FROM Orders o JOIN Customers c ON
    (o.CustomerID = c.CustomerID)
WHERE o.OrderDate >= '1997-01-01'
GROUP BY c.CompanyName
HAVING COUNT(o.OrderID) >= 10
ORDER BY nums DESC;

SELECT CompanyName, ProductID, UnitPrice * Quantity * (1 - Discount) tp
FROM OrderDetails od
    JOIN Orders o ON (o.OrderID = od.OrderID)
    JOIN Customers c ON (c.CustomerID = o.CustomerID)
WHERE UnitPrice * Quantity * (1 - Discount) >= 10000

------------------------------------------
SELECT CompanyName, ProductID, UnitPrice * Quantity * (1 - Discount) tp
FROM OrderDetails od, Orders o, Customers c
WHERE o.OrderID = od.OrderID 
    AND c.CustomerID = o.CustomerID 
    AND UnitPrice * Quantity * (1 - Discount) >= 10000

＝＝＝＝＝＝＝＝＝＝＝＝＝＝＝＝＝＝＝＝＝＝＝＝
CASE
    WHEN ... THEN
    WHEN ... THEN
END
==> 一個查詢資料項
＝＝＝＝＝＝＝＝＝＝＝＝＝＝＝＝＝＝＝

SELECT City, Country FROM Customers;

mysql> SELECT EmployeeID, LastName, City, Country FROM Employees
    -> WHERE ROW(City,Country) IN
    -> (SELECT City, Country FROM Customers);

mysql> SELECT MAX(UnitPrice) FROM OrderDetails WHERE ProductID = 47;
mysql> SELECT UnitPrice FROM OrderDetails WHERE ProductID = 47;

mysql> SELECT p.ProductID, p.ProductName, MAX(od.UnitPrice)
    -> FROM Products p
    ->     JOIN OrderDetails od ON (p.ProductID = od.ProductID)
    -> WHERE p.ProductID = 47;

mysql> select productid, max(unitprice) from orderdetails group by productid;

銷售業績排行榜
員工編號, LastName, total

SELECT e.EmployeeID, e.LastName, SUM(UnitPrice * Quantity) total
FROM Orders o 
    JOIN OrderDetails od ON (o.OrderID = od.OrderID)
    JOIN Employees e ON (o.EmployeeID = e.EmployeeID)
GROUP BY o.EmployeeID
ORDER BY total DESC;

mysql> SELECT e.EmployeeID, e.LastName, SUM(od.UnitPrice * od.Quantity) tp
    -> FROM Employees e
    ->     JOIN Orders o ON (o.EmployeeID = e.EmployeeID)
    ->     JOIN OrderDetails od ON (od.OrderID = o.OrderID)
    -> WHERE e.EmployeeID = 4;

mysql> SELECT p.ProductName, s.CompanyName, s.ContactName, s.Phone
    -> FROM Products p, Suppliers s
    -> WHERE p.SupplierID = s.SupplierID;


SELECT p.ProductName, s.CompanyName, s.ContactName, s.Phone
FROM Products p 
    JOIN Suppliers s USING (SupplierID);

mysql> use class2;
Reading table information for completion of table and column names
You can turn off this feature to get a quicker startup with -A

Database changed
mysql> SELECT cID, cName, score FROM students;
+-----+-----------+-------+
| cID | cName     | score |
+-----+-----------+-------+
|  11 | 簡奉君    |     7 |
|  12 | 黃靖輪    |    67 |
|  13 | 潘四敬    |    13 |
|  14 | 賴勝恩    |    67 |
|  15 | 黎楚寧    |    96 |
|  16 | 蔡中穎    |    75 |
|  17 | 徐佳螢    |    87 |
|  18 | 林雨媗    |    10 |
|  19 | 林心儀    |    93 |
|  20 | 王燕博    |    33 |
|  21 | Brad      |    85 |
|  22 | Brad      |    26 |
|  23 | 資策會    |    75 |
+-----+-----------+-------+
13 rows in set (0.00 sec)

mysql> CREATE VIEW scoreView AS
    -> SELECT cID, cName, score FROM students;
Query OK, 0 rows affected (0.01 sec)

mysql> show tables;
+------------------+
| Tables_in_class2 |
+------------------+
| scoreview        |
| students         |
+------------------+
2 rows in set (0.00 sec)

mysql> DESC scoreView;
+-------+------------------------------+------+-----+---------+-------+
| Field | Type                         | Null | Key | Default | Extra |
+-------+------------------------------+------+-----+---------+-------+
| cID   | tinyint(2) unsigned zerofill | NO   |     | 00      |       |
| cName | varchar(20)                  | NO   |     | NULL    |       |
| score | int(10) unsigned             | NO   |     | 0       |       |
+-------+------------------------------+------+-----+---------+-------+
3 rows in set (0.00 sec)

mysql> SELECT * FROM scoreView;
+-----+-----------+-------+
| cID | cName     | score |
+-----+-----------+-------+
|  11 | 簡奉君    |     7 |
|  12 | 黃靖輪    |    67 |
|  13 | 潘四敬    |    13 |
|  14 | 賴勝恩    |    67 |
|  15 | 黎楚寧    |    96 |
|  16 | 蔡中穎    |    75 |
|  17 | 徐佳螢    |    87 |
|  18 | 林雨媗    |    10 |
|  19 | 林心儀    |    93 |
|  20 | 王燕博    |    33 |
|  21 | Brad      |    85 |
|  22 | Brad      |    26 |
|  23 | 資策會    |    75 |
+-----+-----------+-------+
13 rows in set (0.00 sec)

mysql> SELECT * FROM students;
+-----+-----------+------+------------+-----------------------+------------+---------------------------------+-------+--------+
| cID | cName     | cSex | cBirthday  | cEmail                | cPhone     | cAddr                           | score | mytest |
+-----+-----------+------+------------+-----------------------+------------+---------------------------------+-------+--------+
|  11 | 簡奉君    | F    | 1987-04-04 | elven@superstar.com   | 0922988876 | 台北市濟洲北路12號              |     7 |        |
|  12 | 黃靖輪    | M    | 1987-07-01 | jinglun@superstar.com | 0918181111 | 台北市敦化南路93號5樓           |    67 |        |
|  13 | 潘四敬    | M    | 1987-08-11 | sugie@superstar.com   | 0914530768 | 台北市中央路201號7樓            |    13 |        |
|  14 | 賴勝恩    | M    | 1984-06-20 | shane@superstar.com   | 0946820035 | 台北市建國路177號6樓            |    67 |        |
|  15 | 黎楚寧    | F    | 1988-02-15 | ivy@superstar.com     | 0920981230 | 台北市忠孝東路520號6樓          |    96 |        |
|  16 | 蔡中穎    | M    | 1987-05-05 | zhong@superstar.com   | 0951983366 | 台北市三民路1巷10號             |    75 |        |
|  17 | 徐佳螢    | F    | 1985-08-30 | lala@superstar.com    | 0918123456 | 台北市仁愛路100號               |    87 |        |
|  18 | 林雨媗    | F    | 1986-12-10 | crystal@superstar.com | 0907408965 | 台北市民族路204號               |    10 |        |
|  19 | 林心儀    | F    | 1988-12-01 | peggy@superstar.com   | 0916456723 | 台北市建國北路10號              |    93 |        |
|  20 | 王燕博    | M    | 1993-08-10 | albert@superstar.com  | 0918976588 | 台北市北環路2巷80號             |    33 |        |
|  21 | Brad      | M    | 1999-01-02 | brad@brad.tw          |            | 台中市                          |    85 | 12B3   |
|  22 | Brad      | F    | 1999-01-02 | NULL                  |            | 台中市                          |    26 | 456    |
|  23 | 資策會    | M    | 1999-01-02 | NULL                  |            | 台中市                          |    75 |        |
+-----+-----------+------+------------+-----------------------+------------+---------------------------------+-------+--------+
13 rows in set (0.00 sec)

mysql> UPDATE students SET score = 17 WHERE cID = 11;
Query OK, 1 row affected (0.00 sec)
Rows matched: 1  Changed: 1  Warnings: 0

mysql> SELECT * FROM students;
+-----+-----------+------+------------+-----------------------+------------+---------------------------------+-------+--------+
| cID | cName     | cSex | cBirthday  | cEmail                | cPhone     | cAddr                           | score | mytest |
+-----+-----------+------+------------+-----------------------+------------+---------------------------------+-------+--------+
|  11 | 簡奉君    | F    | 1987-04-04 | elven@superstar.com   | 0922988876 | 台北市濟洲北路12號              |    17 |        |
|  12 | 黃靖輪    | M    | 1987-07-01 | jinglun@superstar.com | 0918181111 | 台北市敦化南路93號5樓           |    67 |        |
|  13 | 潘四敬    | M    | 1987-08-11 | sugie@superstar.com   | 0914530768 | 台北市中央路201號7樓            |    13 |        |
|  14 | 賴勝恩    | M    | 1984-06-20 | shane@superstar.com   | 0946820035 | 台北市建國路177號6樓            |    67 |        |
|  15 | 黎楚寧    | F    | 1988-02-15 | ivy@superstar.com     | 0920981230 | 台北市忠孝東路520號6樓          |    96 |        |
|  16 | 蔡中穎    | M    | 1987-05-05 | zhong@superstar.com   | 0951983366 | 台北市三民路1巷10號             |    75 |        |
|  17 | 徐佳螢    | F    | 1985-08-30 | lala@superstar.com    | 0918123456 | 台北市仁愛路100號               |    87 |        |
|  18 | 林雨媗    | F    | 1986-12-10 | crystal@superstar.com | 0907408965 | 台北市民族路204號               |    10 |        |
|  19 | 林心儀    | F    | 1988-12-01 | peggy@superstar.com   | 0916456723 | 台北市建國北路10號              |    93 |        |
|  20 | 王燕博    | M    | 1993-08-10 | albert@superstar.com  | 0918976588 | 台北市北環路2巷80號             |    33 |        |
|  21 | Brad      | M    | 1999-01-02 | brad@brad.tw          |            | 台中市                          |    85 | 12B3   |
|  22 | Brad      | F    | 1999-01-02 | NULL                  |            | 台中市                          |    26 | 456    |
|  23 | 資策會    | M    | 1999-01-02 | NULL                  |            | 台中市                          |    75 |        |
+-----+-----------+------+------------+-----------------------+------------+---------------------------------+-------+--------+
13 rows in set (0.00 sec)

mysql> SELECT * FROM scoreView;
+-----+-----------+-------+
| cID | cName     | score |
+-----+-----------+-------+
|  11 | 簡奉君    |    17 |
|  12 | 黃靖輪    |    67 |
|  13 | 潘四敬    |    13 |
|  14 | 賴勝恩    |    67 |
|  15 | 黎楚寧    |    96 |
|  16 | 蔡中穎    |    75 |
|  17 | 徐佳螢    |    87 |
|  18 | 林雨媗    |    10 |
|  19 | 林心儀    |    93 |
|  20 | 王燕博    |    33 |
|  21 | Brad      |    85 |
|  22 | Brad      |    26 |
|  23 | 資策會    |    75 |
+-----+-----------+-------+
13 rows in set (0.00 sec)

mysql> UPDATE scoreView SET score = 27 WHERE cID = 11;
Query OK, 1 row affected (0.00 sec)
Rows matched: 1  Changed: 1  Warnings: 0

mysql> SELECT * FROM scoreView;
+-----+-----------+-------+
| cID | cName     | score |
+-----+-----------+-------+
|  11 | 簡奉君    |    27 |
|  12 | 黃靖輪    |    67 |
|  13 | 潘四敬    |    13 |
|  14 | 賴勝恩    |    67 |
|  15 | 黎楚寧    |    96 |
|  16 | 蔡中穎    |    75 |
|  17 | 徐佳螢    |    87 |
|  18 | 林雨媗    |    10 |
|  19 | 林心儀    |    93 |
|  20 | 王燕博    |    33 |
|  21 | Brad      |    85 |
|  22 | Brad      |    26 |
|  23 | 資策會    |    75 |
+-----+-----------+-------+
13 rows in set (0.00 sec)

mysql> SELECT * FROM students;
+-----+-----------+------+------------+-----------------------+------------+---------------------------------+-------+--------+
| cID | cName     | cSex | cBirthday  | cEmail                | cPhone     | cAddr                           | score | mytest |
+-----+-----------+------+------------+-----------------------+------------+---------------------------------+-------+--------+
|  11 | 簡奉君    | F    | 1987-04-04 | elven@superstar.com   | 0922988876 | 台北市濟洲北路12號              |    27 |        |
|  12 | 黃靖輪    | M    | 1987-07-01 | jinglun@superstar.com | 0918181111 | 台北市敦化南路93號5樓           |    67 |        |
|  13 | 潘四敬    | M    | 1987-08-11 | sugie@superstar.com   | 0914530768 | 台北市中央路201號7樓            |    13 |        |
|  14 | 賴勝恩    | M    | 1984-06-20 | shane@superstar.com   | 0946820035 | 台北市建國路177號6樓            |    67 |        |
|  15 | 黎楚寧    | F    | 1988-02-15 | ivy@superstar.com     | 0920981230 | 台北市忠孝東路520號6樓          |    96 |        |
|  16 | 蔡中穎    | M    | 1987-05-05 | zhong@superstar.com   | 0951983366 | 台北市三民路1巷10號             |    75 |        |
|  17 | 徐佳螢    | F    | 1985-08-30 | lala@superstar.com    | 0918123456 | 台北市仁愛路100號               |    87 |        |
|  18 | 林雨媗    | F    | 1986-12-10 | crystal@superstar.com | 0907408965 | 台北市民族路204號               |    10 |        |
|  19 | 林心儀    | F    | 1988-12-01 | peggy@superstar.com   | 0916456723 | 台北市建國北路10號              |    93 |        |
|  20 | 王燕博    | M    | 1993-08-10 | albert@superstar.com  | 0918976588 | 台北市北環路2巷80號             |    33 |        |
|  21 | Brad      | M    | 1999-01-02 | brad@brad.tw          |            | 台中市                          |    85 | 12B3   |
|  22 | Brad      | F    | 1999-01-02 | NULL                  |            | 台中市                          |    26 | 456    |
|  23 | 資策會    | M    | 1999-01-02 | NULL                  |            | 台中市                          |    75 |        |
+-----+-----------+------+------------+-----------------------+------------+---------------------------------+-------+--------+
13 rows in set (0.00 sec)



